{
  "id": "SRC-cisa-agentic",
  "title": "CISA & International Partners Release Guide to Secure Adoption of Agentic AI | CISA",
  "source_tier": "official-guidance",
  "publisher": "US CISA (with ASD ACSC, NSA, FBI, UK/CA/NZ/DE/NL partners)",
  "url": "https://www.cisa.gov/news-events/news/cisa-us-and-international-partners-release-guide-secure-adoption-agentic-ai",
  "published_date": "2025-12-03",
  "retrieval_date": "2026-06-01",
  "accessed_via": "deep-research",
  "locator": {
    "kind": "web",
    "ref": "https://www.cisa.gov/resources-tools/resources/careful-adoption-agentic-ai-services"
  },
  "classification": "OFFICIAL",
  "trust": "trusted",
  "excerpt": "Joint guide 'Careful Adoption of Agentic AI Services' from CISA with ASD ACSC and partners: security challenges/risks of agentic AI and recommended mitigations for designers, vendors and operators.",
  "content_hash": "sha256:e9f16e8b3d28d577ccb3ce36763588f52e954a58d58e98bad22b2f817e6fb69c"
}
