{
  "id": "SRC-acsc-ism",
  "title": "Information security manual | Cyber.gov.au",
  "source_tier": "authoritative-standard",
  "publisher": "Australian Signals Directorate (ASD) / ACSC",
  "url": "https://www.cyber.gov.au/business-government/asds-cyber-security-frameworks/ism",
  "published_date": "2026-03-01",
  "retrieval_date": "2026-06-01",
  "accessed_via": "deep-research",
  "locator": {
    "kind": "web",
    "ref": "https://www.cyber.gov.au/sites/default/files/2026-03/Information%20security%20manual%20(March%202026).pdf"
  },
  "classification": "OFFICIAL",
  "trust": "trusted",
  "excerpt": "Information security manual Last updated: March 2026",
  "content_hash": "sha256:9b944692389616124ce5103d67dd818417283d404bcca4cfee7c3423de5f43ef"
}
