{
  "id": "SRC-rulesync-repo",
  "title": "dyoshikawa/rulesync — A Utility CLI for AI Coding Agents",
  "source_tier": "primary",
  "publisher": "GitHub / dyoshikawa",
  "url": "https://github.com/dyoshikawa/rulesync",
  "retrieval_date": "2026-06-01",
  "accessed_via": "deep-research",
  "locator": {
    "kind": "web",
    "ref": "https://github.com/dyoshikawa/rulesync"
  },
  "classification": "OFFICIAL",
  "trust": "trusted",
  "excerpt": "Node.js CLI tool that generates configuration files for AI development tools from unified rule files... supports 30+ agents (Copilot, Cursor, Claude Code, Codex CLI, Gemini CLI...). Unified syntax for rules, ignore files, MCP, commands, subagents, skills. v8.23.0 (May 2026), 242 releases, MIT, ~1.1k stars.",
  "content_hash": "sha256:3dc31915e118214bb79f7fd515bfaff3df87d87f8701dbb197a7daaf8998c590"
}
